{
  "$schema": "https://json-schema.org/draft/2020-12/schema",
  "$id": "https://veripower.local/skills/specification/top-io.schema.json",
  "title": "top-io.json — the module's top-level IO ports (authored, never derived)",
  "description": "The DUT boundary. derive-constraints renders create_clock / set_input_delay / set_output_delay / abstract_port from it; simulation-plan derives agents and transaction fields from it; each rtl-design child reads it for set_case_analysis. A reset row also declares polarity and kind.",
  "type": "array",
  "minItems": 1,
  "items": {
    "type": "object",
    "required": ["name", "direction", "width", "clock_domain", "interface_group", "role"],
    "additionalProperties": false,
    "allOf": [
      {
        "if": {"properties": {"role": {"const": "reset"}}, "required": ["role"]},
        "then": {"required": ["reset_polarity", "reset_kind"]}
      }
    ],
    "properties": {
      "name": {
        "description": "The port's base identifier, carrying NO bit range: `token_in`, never `token_in[4:0]`. This string is rendered verbatim into get_ports / abstract_port and into the TB signal declaration, and a bit range resolves in none of them — get_ports matches zero ports for one, leaving that port silently unconstrained. `width` is the only carrier of the width; rejected when this file is read.",
        "type": "string",
        "minLength": 1
      },
      "direction": {"enum": ["input", "output", "inout"]},
      "width": {
        "description": "Bit width, elaborated: a port declared `[DATA_WIDTH-1:0]` records the resolved integer, since no downstream tool evaluates the parameter. Scalars are 1.",
        "type": "integer",
        "minimum": 1
      },
      "clock_domain": {
        "description": "A clocks.json name. Clock and async-reset ports carry no IO delay; every other port, a synchronous reset included, gets set_input/output_delay against this domain.",
        "type": "string",
        "minLength": 1
      },
      "interface_group": {
        "description": "Groups ports into one TB agent / one vif.",
        "type": "string",
        "minLength": 1
      },
      "role": {"enum": ["clock", "reset", "data"]},
      "protocol": {"type": "string", "minLength": 1},
      "encoding": {
        "description": "A control or status port pins its bit/field-to-symbol meaning here: single-bit as \"0:<meaning>; 1:<meaning>\", multi-bit per field as \"bit[h:l] <name>: <code>:<symbol>; …\". For a phase or command code write the CONSUMER OBLIGATION, not just a label — e.g. \"3:PV (consumer re-preloads the stationary operand, then streams)\". This entry is the single source: a child names the port and never re-describes the codes. Raw data / clock / reset ports have none. Judged by the spec-review reviewer, not by a deterministic gate.",
        "type": "string",
        "minLength": 1
      },
      "reset_polarity": {"enum": [0, 1]},
      "reset_kind": {"enum": ["sync", "async"]}
    }
  }
}
